{
  "version": 1,
  "generatedAt": "2026-08-21T04:21:12.407Z",
  "runId": "32446622511",
  "overall": "operational",
  "monitors": [
    {
      "id": "llm-api",
      "name": "对话 API",
      "group": "对外入口",
      "status": "operational",
      "ms": 834,
      "reason": null,
      "lastCheckedAt": "2026-08-21T04:21:12.407Z",
      "since": "2026-08-11T04:14:06.344Z",
      "openIncident": null
    },
    {
      "id": "account",
      "name": "账号服务",
      "group": "对外入口",
      "status": "operational",
      "ms": 725,
      "reason": null,
      "lastCheckedAt": "2026-08-21T04:21:12.407Z",
      "since": "2026-08-18T17:37:07.772Z",
      "openIncident": null
    },
    {
      "id": "admin",
      "name": "管理后台",
      "group": "对外入口",
      "status": "operational",
      "ms": 951,
      "reason": null,
      "lastCheckedAt": "2026-08-21T04:21:12.407Z",
      "since": "2026-08-18T10:36:11.709Z",
      "openIncident": null
    },
    {
      "id": "context",
      "name": "内容服务（经对话 API 探测）",
      "group": "内部依赖",
      "status": "operational",
      "ms": 865,
      "reason": null,
      "lastCheckedAt": "2026-08-21T04:21:12.407Z",
      "since": "2026-08-18T17:37:07.772Z",
      "openIncident": null
    },
    {
      "id": "postgres",
      "name": "主数据库（经账号服务探测）",
      "group": "内部依赖",
      "status": "operational",
      "ms": 1078,
      "reason": null,
      "lastCheckedAt": "2026-08-21T04:21:12.407Z",
      "since": "2026-08-17T18:41:15.147Z",
      "openIncident": null
    },
    {
      "id": "mcp",
      "name": "MCP 接入",
      "group": "内部依赖",
      "status": "operational",
      "ms": 939,
      "reason": null,
      "lastCheckedAt": "2026-08-21T04:21:12.407Z",
      "since": "2026-08-11T04:14:06.344Z",
      "openIncident": null
    }
  ],
  "activeMaintenances": []
}
